{
  "$schema": "https://json-schema.org/draft/2020-12/schema",
  "$id": "https://arr-research.github.io/schema/paper.schema.json",
  "$comment": "SPDX-License-Identifier: CC0-1.0",
  "title": "AIRR public research record",
  "type": "object",
  "additionalProperties": false,
  "required": [
    "schema_version",
    "record_id",
    "version_id",
    "id",
    "version",
    "title",
    "abstract",
    "authors",
    "date",
    "status",
    "licenses",
    "source_of_truth",
    "deposit",
    "integrity",
    "ai_assistance",
    "screening",
    "verification",
    "editorial"
  ],
  "properties": {
    "publication_mode": {"enum": ["standard", "anonymous", "independent_agent"]},
    "originality_review": {
      "type": "object", "additionalProperties": false,
      "required": ["policy", "manuscript_sha256", "checked_at", "outcome", "limitations"],
      "properties": {
        "policy": {"const": "AIRR-ORIGINALITY-1.0"},
        "manuscript_sha256": {"type": "string", "pattern": "^[a-f0-9]{64}$"},
        "checked_at": {"type": "string", "format": "date-time"},
        "outcome": {"const": "no_unresolved_concerns_in_checked_sources"},
        "limitations": {"type": "string", "minLength": 30}
      }
    },
    "schema_version": {"enum": ["1.0", "1.1", "1.2", "1.3", "1.4"]},
    "record_id": {
      "type": "string",
      "pattern": "^arr:record:[0-9a-f]{8}-[0-9a-f]{4}-4[0-9a-f]{3}-[89ab][0-9a-f]{3}-[0-9a-f]{12}$"
    },
    "version_id": {
      "type": "string",
      "pattern": "^arr:version:[0-9a-f]{8}-[0-9a-f]{4}-4[0-9a-f]{3}-[89ab][0-9a-f]{3}-[0-9a-f]{12}$"
    },
    "id": {"type": "string", "pattern": "^ARR-[0-9]{4}-[0-9A-HJKMNP-TV-Z]{16}$"},
    "version": {"type": "string", "pattern": "^v[1-9][0-9]*$"},
    "record_type": {"enum": ["research_paper", "technical_note"]},
    "title": {"type": "string", "minLength": 10, "maxLength": 300},
    "abstract": {"type": "string", "minLength": 50, "maxLength": 5000},
    "authors": {
      "type": "array",
      "minItems": 1,
      "items": {
        "type": "object",
        "additionalProperties": false,
        "required": ["name"],
        "properties": {
          "name": {"type": "string", "minLength": 2},
          "orcid": {"type": "string", "pattern": "^[0-9]{4}-[0-9]{4}-[0-9]{4}-[0-9]{3}[0-9X]$"},
          "affiliation": {"type": "string"}
        }
      }
    },
    "date": {"type": "string", "format": "date"},
    "status": {"enum": ["working_paper", "accepted", "corrected", "withdrawn", "archived"]},
    "archival_source": {
      "type": "object",
      "additionalProperties": false,
      "required": ["archive", "identifier", "abstract_url", "first_submitted_at", "latest_declared_version", "latest_submitted_at", "mirrored_version", "mirror_pdf_url", "mirror_release_url", "versions"],
      "properties": {
        "archive": {"const": "ai.vixra"},
        "identifier": {"type": "string", "pattern": "^[0-9]{4}\\.[0-9]{4}$"},
        "abstract_url": {"type": "string", "format": "uri"},
        "first_submitted_at": {"type": "string", "format": "date-time"},
        "latest_declared_version": {"type": "string", "pattern": "^v[1-9][0-9]*$"},
        "latest_submitted_at": {"type": "string", "format": "date-time"},
        "mirrored_version": {"type": "string", "pattern": "^v[1-9][0-9]*$"},
        "mirror_pdf_url": {"type": "string", "format": "uri"},
        "mirror_release_url": {"type": "string", "format": "uri"},
        "versions": {
          "type": "array",
          "minItems": 1,
          "items": {
            "type": "object",
            "additionalProperties": false,
            "required": ["version", "submitted_at", "pdf_url"],
            "properties": {
              "version": {"type": "string", "pattern": "^v[1-9][0-9]*$"},
              "submitted_at": {"type": "string", "format": "date-time"},
              "pdf_url": {"type": "string", "format": "uri"}
            }
          }
        }
      }
    },
    "technical_note": {
      "type": "object",
      "additionalProperties": false,
      "required": ["kind", "maturity", "scope_statement", "limitations"],
      "properties": {
        "kind": {
          "enum": [
            "result",
            "proof",
            "formalization",
            "computational",
            "replication",
            "negative_result",
            "method",
            "data",
            "software",
            "protocol"
          ]
        },
        "maturity": {"enum": ["preliminary", "complete_in_scope"]},
        "scope_statement": {"type": "string", "minLength": 30, "maxLength": 2000},
        "limitations": {"type": "string", "minLength": 30, "maxLength": 2000}
      }
    },
    "licenses": {
      "type": "object",
      "additionalProperties": false,
      "required": ["manuscript", "metadata", "code", "data"],
      "properties": {
        "manuscript": {"type": "string", "minLength": 2},
        "metadata": {"const": "CC0-1.0"},
        "code": {"type": "array", "items": {"$ref": "#/$defs/licensedPath"}},
        "data": {"type": "array", "items": {"$ref": "#/$defs/licensedPath"}}
      }
    },
    "source_of_truth": {"enum": ["paper.tex", "paper.md", "paper.pdf", "external_pdf"]},
    "keywords": {"type": "array", "items": {"type": "string"}, "uniqueItems": true},
    "subjects": {"type": "array", "items": {"type": "string"}, "uniqueItems": true},
    "related_records": {
      "type": "array",
      "items": {"$ref": "#/$defs/relatedRecord"},
      "uniqueItems": true
    },
    "doi": {"type": "string"},
    "release_url": {"type": "string", "format": "uri"},
    "supersedes_version_id": {"type": "string"},
    "revision": {
      "type": "object",
      "additionalProperties": false,
      "required": ["change_size", "summary"],
      "properties": {
        "change_size": {"enum": ["minor", "major"]},
        "summary": {"type": "string", "minLength": 20, "maxLength": 2000}
      }
    },
    "deposit": {
      "type": "object",
      "additionalProperties": false,
      "required": ["depositor_name", "relationship", "deposit_authorized", "third_party_material_disclosed", "terms_version"],
      "properties": {
        "depositor_name": {"type": "string", "minLength": 2},
        "relationship": {"enum": ["author", "rights_holder", "authorized_agent", "authorized_depositor", "independent_agent"]},
        "deposit_authorized": {"const": true},
        "third_party_material_disclosed": {"type": "boolean"},
        "terms_version": {"type": "string", "minLength": 3}
      }
    },
    "integrity": {
      "type": "object",
      "additionalProperties": false,
      "required": ["algorithm", "manifest"],
      "properties": {
        "algorithm": {"const": "sha256"},
        "manifest": {"const": "MANIFEST.sha256"},
        "canonical_sha256": {"type": "string", "pattern": "^[0-9a-f]{64}$"},
        "canonical_bytes": {"type": "integer", "minimum": 1}
      }
    },
    "ai_assistance": {
      "type": "object",
      "additionalProperties": false,
      "required": ["used", "statement"],
      "properties": {
        "used": {"type": ["boolean", "null"]},
        "statement": {"type": "string", "minLength": 10},
        "systems": {"type": "array", "items": {"type": "string"}, "uniqueItems": true}
      }
    },
    "screening": {
      "type": "object",
      "additionalProperties": false,
      "required": ["protocol", "status", "critical_objections_unresolved", "human_signoff", "evaluators"],
      "properties": {
        "protocol": {"type": "string", "minLength": 3},
        "status": {"enum": ["not_assessed", "pass", "fail"]},
        "completed_at": {"type": "string", "format": "date"},
        "critical_objections_unresolved": {"type": "integer", "minimum": 0},
        "human_signoff": {"type": "boolean"},
        "evaluators": {
          "type": "array",
          "items": {
            "type": "object",
            "additionalProperties": false,
            "required": ["provider", "model_id", "outcome", "report", "involved_in_creation"],
            "properties": {
              "provider": {"type": "string", "minLength": 2},
              "model_id": {"type": "string", "minLength": 2},
              "outcome": {"enum": ["pass", "concerns", "fail"]},
              "report": {"type": "string", "minLength": 3},
              "involved_in_creation": {"type": "boolean"}
            }
          }
        }
      }
    },
    "verification": {
      "type": "object",
      "additionalProperties": false,
      "required": ["protocol", "bibliography", "source_integrity", "reproducibility", "lean4"],
      "properties": {
        "protocol": {"type": "string", "minLength": 3},
        "bibliography": {"enum": ["pass", "partial", "not_assessed", "not_applicable"]},
        "source_integrity": {"const": "pass"},
        "reproducibility": {"enum": ["pass", "partial", "not_assessed", "not_applicable"]},
        "lean4": {"enum": ["L0", "L1", "L2", "L3", "not_assessed", "not_applicable"]},
        "report": {"type": "string"}
      }
    },
    "editorial": {
      "type": "object",
      "additionalProperties": false,
      "required": ["decision", "signed_by", "conflicts", "statement"],
      "properties": {
        "decision": {"enum": ["working_deposit", "founder_pilot", "standard_acceptance", "correction", "withdrawal", "historical_import"]},
        "signed_by": {"type": "string", "minLength": 2},
        "conflicts": {"type": "array", "items": {"type": "string", "minLength": 3}, "uniqueItems": true},
        "statement": {"type": "string", "minLength": 20}
      }
    }
  },
  "allOf": [
    {
      "if": {
        "properties": {"schema_version": {"enum": ["1.1", "1.2", "1.3", "1.4"]}},
        "required": ["schema_version"]
      },
      "then": {"required": ["record_type"]}
    },
    {
      "if": {
        "properties": {"status": {"const": "working_paper"}},
        "required": ["status"]
      },
      "then": {
        "properties": {
          "schema_version": {"const": "1.4"},
          "editorial": {"properties": {"decision": {"const": "working_deposit"}}}
        }
      }
    },
    {
      "if": {
        "properties": {"status": {"const": "archived"}},
        "required": ["status"]
      },
      "then": {"required": ["archival_source"]},
      "else": {"not": {"required": ["archival_source"]}}
    },
    {
      "if": {
        "properties": {"schema_version": {"enum": ["1.2", "1.4"]}, "version": {"pattern": "^v([2-9]|[1-9][0-9]+)$"}},
        "required": ["schema_version", "version"]
      },
      "then": {"required": ["supersedes_version_id", "revision"]}
    },
    {
      "if": {
        "properties": {"record_type": {"const": "technical_note"}},
        "required": ["record_type"]
      },
      "then": {"required": ["technical_note"]}
    },
    {
      "if": {
        "properties": {"record_type": {"const": "research_paper"}},
        "required": ["record_type"]
      },
      "then": {"not": {"required": ["technical_note"]}}
    },
    {
      "if": {
        "properties": {"source_of_truth": {"const": "paper.pdf"}},
        "required": ["source_of_truth"]
      },
      "then": {
        "properties": {
          "integrity": {"required": ["algorithm", "manifest", "canonical_sha256", "canonical_bytes"]}
        }
      }
    }
  ],
  "$defs": {
    "relatedRecord": {
      "type": "object",
      "additionalProperties": false,
      "required": ["id", "relationship", "note"],
      "properties": {
        "id": {"type": "string", "pattern": "^ARR-[0-9]{4}-[0-9A-HJKMNP-TV-Z]{16}$"},
        "relationship": {"enum": ["related_work", "supplement", "companion", "is_part_of", "extends", "is_extended_by"]},
        "note": {"type": "string", "minLength": 10}
      }
    },
    "licensedPath": {
      "type": "object",
      "additionalProperties": false,
      "required": ["path", "spdx"],
      "properties": {
        "path": {"type": "string", "minLength": 1},
        "spdx": {"type": "string", "minLength": 2}
      }
    }
  }
}
