{
  "schema_version": "1.3",
  "record_id": "arr:record:902b8918-1eb4-47a0-b3e7-494ab6094a92",
  "version_id": "arr:version:0beec367-4819-49de-933a-4753669993e8",
  "id": "ARR-2026-4G5E4HG7NM8YGB7S",
  "version": "v1",
  "record_type": "research_paper",
  "title": "Typed Pipeline for Recoverability-Rate-Power Links: A Contract Paper with a Closed Recoverability Lane and Falsification Criteria",
  "abstract": "We present an audit-friendly logical contract for a multi-layer program connecting (i) static locality/Markovness, (ii) recoverability bounds, (iii) separation-dependent dissipation rates, and (iv) thermodynamic maintenance power. Each interface is typed with explicit quantifiers, tagged as [PROVED]/[IMPORTED]/[ASSUMED]/[CONJECTURED], and paired with falsification routes. We do not claim a proof of the Clay Yang-Mills mass gap; we separate a Clay (closed-Hamiltonian) track from an operational (open-system/maintenance) track. As a fully closed lane inside this paper, we prove that an exponential conditional mutual information (CMI) decay hypothesis implies exponential recoverability via an imported Fawzi-Renner inequality, with fidelity conventions fixed explicitly. v2 (no v1 number is changed): the cross-reference labels are repaired (in v1 every assumption, lemma, theorem, remark and corollary was typeset as \"Definition x.y\") and Tables 1 and 2 are re-typeset; the constant-alignment step of Appendix A is executed rather than prescribed -- in the locked conventions (squared fidelity, E_rec = -log F) the Fawzi-Renner import yields c_FR = 1 exactly; the deferred interfaces of Appendix B are now concrete series papers and are cited as such (the Type III interface is ai.viXra:2601.0065, the Davies/RIP-U dynamics note is ai.viXra:2601.0064, the benchmark infrastructure lives in the series repository); the BATO-LAW upgrade path of Appendix C records the partial progress of ai.viXra:2601.0031; and a verification suite instantiates everything instantiable: the closed recoverability lane end to end on a gapped transverse-field Ising collar (I ~ 0.20 e^{-1.06 w}, E_rec <= I at every width in the generated dataset, full 1 - F <= E_rec <= c_FR K e^{-alpha epsilon} chain), the exact-Markov example at machine precision, and the dephasing example with an explicit kappa_up/kappa_down spread of two orders of magnitude illustrating the directionality golden rule.",
  "authors": [
    {
      "name": "Lluis Eriksson",
      "affiliation": "Independent researcher"
    }
  ],
  "date": "2026-01-17",
  "status": "archived",
  "archival_source": {
    "archive": "ai.vixra",
    "identifier": "2601.0066",
    "abstract_url": "https://www.ai.vixra.org/abs/2601.0066",
    "first_submitted_at": "2026-01-17T18:30:12+00:00",
    "latest_declared_version": "v2",
    "latest_submitted_at": "2026-07-05T20:13:04+00:00",
    "mirrored_version": "v2",
    "mirror_pdf_url": "https://github.com/arr-research/arr-research.github.io/releases/download/AIVIXRA-LATEST-2026-08-30/ai-vixra-2601.0066-v2.pdf",
    "mirror_release_url": "https://github.com/arr-research/arr-research.github.io/releases/tag/AIVIXRA-LATEST-2026-08-30",
    "versions": [
      {
        "version": "v1",
        "submitted_at": "2026-01-17T18:30:12+00:00",
        "pdf_url": "https://www.ai.vixra.org/pdf/2601.0066v1.pdf"
      },
      {
        "version": "v2",
        "submitted_at": "2026-07-05T20:13:04+00:00",
        "pdf_url": "https://www.ai.vixra.org/pdf/2601.0066v2.pdf"
      }
    ]
  },
  "licenses": {
    "manuscript": "LicenseRef-Author-Retained",
    "metadata": "CC0-1.0",
    "code": [],
    "data": []
  },
  "source_of_truth": "external_pdf",
  "keywords": [
    "Quantum Physics"
  ],
  "subjects": [
    "Quantum Physics"
  ],
  "deposit": {
    "depositor_name": "Lluis Eriksson",
    "relationship": "author",
    "deposit_authorized": true,
    "third_party_material_disclosed": false,
    "terms_version": "ARR-HISTORICAL-IMPORT-1.0"
  },
  "integrity": {
    "algorithm": "sha256",
    "manifest": "MANIFEST.sha256",
    "canonical_sha256": "ded20a40e5090439d85d2cbf07af4c0c16d89a2d48e96b59360319a0deff747e",
    "canonical_bytes": 318994
  },
  "ai_assistance": {
    "used": true,
    "statement": "Historical import from ai.vixra, an AI-assisted e-print archive. ARR has not normalized or independently verified the original manuscript's model-use disclosure; the author remains responsible for its contents."
  },
  "screening": {
    "protocol": "ARR-SCREEN-1.0",
    "status": "not_assessed",
    "critical_objections_unresolved": 0,
    "human_signoff": true,
    "evaluators": []
  },
  "verification": {
    "protocol": "ARR-HISTORICAL-IMPORT-1.0",
    "bibliography": "not_assessed",
    "source_integrity": "pass",
    "reproducibility": "not_assessed",
    "lean4": "not_assessed",
    "report": "VERIFICATION.md"
  },
  "editorial": {
    "decision": "historical_import",
    "signed_by": "Lluis Eriksson",
    "conflicts": [
      "author_is_founder_editor"
    ],
    "statement": "Author-authorized historical import. ARR verified file retrieval and integrity only; it did not perform the current hostile frontier-model admission audit, peer review, novelty review, or correctness certification."
  }
}
