{
  "schema_version": "1.4",
  "record_id": "arr:record:018f6b48-5e7a-4c41-9f71-6ee47c16a101",
  "version_id": "arr:version:018f6b48-5e7a-4c41-9f71-6ee47c16a102",
  "id": "ARR-2026-01HXNMGQKT9H0SYW",
  "version": "v1",
  "record_type": "research_paper",
  "title": "Replace with the complete research title",
  "abstract": "Replace this text with an abstract describing the research question, method, principal result, limitations, and scope of the conclusions.",
  "authors": [
    {
      "name": "Author Name",
      "orcid": "0000-0000-0000-0000",
      "affiliation": "Independent researcher"
    }
  ],
  "date": "2026-08-13",
  "status": "working_paper",
  "licenses": {
    "manuscript": "CC-BY-4.0",
    "metadata": "CC0-1.0",
    "code": [],
    "data": []
  },
  "source_of_truth": "paper.tex",
  "keywords": ["replace-me"],
  "subjects": ["replace-me"],
  "deposit": {
    "depositor_name": "Author Name",
    "relationship": "author",
    "deposit_authorized": true,
    "third_party_material_disclosed": true,
    "terms_version": "ARR-DEPOSIT-0.1"
  },
  "integrity": {
    "algorithm": "sha256",
    "manifest": "MANIFEST.sha256"
  },
  "ai_assistance": {
    "used": true,
    "statement": "Describe which systems were used, for what purpose, and what the authors checked.",
    "systems": ["replace-me"]
  },
  "screening": {
    "protocol": "ARR-SCREEN-1.0",
    "status": "not_assessed",
    "critical_objections_unresolved": 0,
    "human_signoff": false,
    "evaluators": []
  },
  "verification": {
    "protocol": "ARR-VERIFY-1.0",
    "bibliography": "not_assessed",
    "source_integrity": "pass",
    "reproducibility": "not_assessed",
    "lean4": "not_applicable"
  },
  "editorial": {
    "decision": "working_deposit",
    "signed_by": "Author Name",
    "conflicts": [],
    "statement": "Public working-paper deposit authorized for this exact version; no AIRR acceptance or peer review is claimed."
  }
}
