{
  "schema_version": "1.3",
  "record_id": "arr:record:6b3d395c-cb21-46bc-a512-d082b39404f5",
  "version_id": "arr:version:27e9d132-504c-449a-a91b-88d306871522",
  "id": "ARR-2026-3B7MWNSJS18TYAA4",
  "version": "v1",
  "record_type": "research_paper",
  "title": "Machine-Checked Finite-Edge SU(2) Crossing Ward Identity: Pauli Generator Transfer and Single-Trace Closure",
  "abstract": "We formalize a finite-dimensional crossing Ward identity for fundamental SU(2) Wilson words. On every finite edge space SU(2)^E, two distinct coordinates are inserted into a concrete normalized trace word. Lean proves entrywise that right multiplication by each of three explicit SU(2) curves produces the normalized Pauli generators i sigma_a/2, differentiates the trace word once at each selected coordinate, and identifies the Pauli-summed mixed derivative with the rank-two Fierz contraction. Two applications of Haar integration by parts transfer the corresponding mixed generators from a density to the Wilson word. The resulting integral closes exactly on the direct and reverse single-trace resolutions, with coefficients -1/4 and -1/2 in the chosen normalization. The producer contains 19 public declarations in 487 physical lines; all 13 new theorems depend only on propext, Classical.choice, and Quot.sound, with no local sorry, admit, or axiom. This is not a full Makeenko--Migdal area equation: the remaining physical input is a weak four-face identity against crossing-certified extended-gauge-invariant observables. In the program's heat time, generated by the Pauli Laplacian, its coefficient is kappa = 2.",
  "authors": [
    {
      "name": "Lluis Eriksson",
      "affiliation": "Independent researcher"
    }
  ],
  "date": "2026-08-02",
  "status": "archived",
  "archival_source": {
    "archive": "ai.vixra",
    "identifier": "2608.0007",
    "abstract_url": "https://www.ai.vixra.org/abs/2608.0007",
    "first_submitted_at": "2026-08-02T14:02:27+00:00",
    "latest_declared_version": "v1",
    "latest_submitted_at": "2026-08-02T14:02:27+00:00",
    "mirrored_version": "v1",
    "mirror_pdf_url": "https://github.com/arr-research/arr-research.github.io/releases/download/AIVIXRA-LATEST-2026-08-30/ai-vixra-2608.0007-v1.pdf",
    "mirror_release_url": "https://github.com/arr-research/arr-research.github.io/releases/tag/AIVIXRA-LATEST-2026-08-30",
    "versions": [
      {
        "version": "v1",
        "submitted_at": "2026-08-02T14:02:27+00:00",
        "pdf_url": "https://www.ai.vixra.org/pdf/2608.0007v1.pdf"
      }
    ]
  },
  "licenses": {
    "manuscript": "LicenseRef-Author-Retained",
    "metadata": "CC0-1.0",
    "code": [],
    "data": []
  },
  "source_of_truth": "external_pdf",
  "keywords": [
    "Mathematical Physics"
  ],
  "subjects": [
    "Mathematical Physics"
  ],
  "deposit": {
    "depositor_name": "Lluis Eriksson",
    "relationship": "author",
    "deposit_authorized": true,
    "third_party_material_disclosed": false,
    "terms_version": "ARR-HISTORICAL-IMPORT-1.0"
  },
  "integrity": {
    "algorithm": "sha256",
    "manifest": "MANIFEST.sha256",
    "canonical_sha256": "3a0ac2c21fe44aa524ad26bf29f15ec245d2c74f14108dc29d934d261d30d17d",
    "canonical_bytes": 421658
  },
  "ai_assistance": {
    "used": true,
    "statement": "Historical import from ai.vixra, an AI-assisted e-print archive. ARR has not normalized or independently verified the original manuscript's model-use disclosure; the author remains responsible for its contents."
  },
  "screening": {
    "protocol": "ARR-SCREEN-1.0",
    "status": "not_assessed",
    "critical_objections_unresolved": 0,
    "human_signoff": true,
    "evaluators": []
  },
  "verification": {
    "protocol": "ARR-HISTORICAL-IMPORT-1.0",
    "bibliography": "not_assessed",
    "source_integrity": "pass",
    "reproducibility": "not_assessed",
    "lean4": "not_assessed",
    "report": "VERIFICATION.md"
  },
  "editorial": {
    "decision": "historical_import",
    "signed_by": "Lluis Eriksson",
    "conflicts": [
      "author_is_founder_editor"
    ],
    "statement": "Author-authorized historical import. ARR verified file retrieval and integrity only; it did not perform the current hostile frontier-model admission audit, peer review, novelty review, or correctness certification."
  }
}
