{
  "schema_version": "1.3",
  "record_id": "arr:record:e7a600b5-85c4-41d8-af61-943e295fe1bc",
  "version_id": "arr:version:1cbf15ae-1471-4e89-9921-fd97329fcd11",
  "id": "ARR-2026-77MR0BB1E487CAYR",
  "version": "v1",
  "record_type": "research_paper",
  "title": "Maintenance Is Not Restoration: Endpoint No-Go Theorems, Exact SSH Resource Horizons, and Quantum Rapid-Replacement Equality",
  "abstract": "Lower bounds based on the instantaneous free-energy loss of a target state are often interpreted as lower bounds on the power required to maintain that state. We show that this interpretation depends decisively on the control task. If maintenance only requires exact restoration at periodically sampled endpoints and the intervention period is unrestricted, the infimal average power can vanish even when the target has strictly positive instantaneous entropy production. A full-rank dephasing qubit gives an exact energy-conserving SWAP counterexample. We repair the formulation by separating endpoint restoration, bounded-latency maintenance, and continuous holding.For continuous-time finite Markov chains we adopt the established trajectory-relative-entropy holding cost and review the known reversible optimizer and Dirichlet-form representation. Our first composition result is then an exact geometric additivity theorem for suppressible and persistent generators sharing a detailed-balance reference. A two-state counterexample shows that this hypothesis is essential: channels with incompatible equilibria can cancel at a finite membrane width. A dual-rail pair of odd fermionic SSH chains supplies the microscopic layer: exact edge modes, a uniform bulk gap, and an explicitly filtered number-conserving Davies coupling produce two-sided holding-cost bounds without an assumed rate-inheritance bridge. The logical basis has fixed particle number and parity, so arbitrary logical coherence is physical under fermionic superselection. Finally, under a fully axiomatized resource-cell ledger, fresh target-state cells and energy-conserving SWAPs saturate the fixed-period free-energy bound; the correctly ordered rapid-control limit closes the SSH theorem for coherent logical targets. The fresh-copy construction is related to earlier collision-model stabilization work and is not claimed as a work-only controller. The remaining frontier is autonomous work-only control without preloaded target copies.",
  "authors": [
    {
      "name": "Lluis Eriksson",
      "affiliation": "Independent researcher"
    }
  ],
  "date": "2026-07-12",
  "status": "archived",
  "archival_source": {
    "archive": "ai.vixra",
    "identifier": "2607.0031",
    "abstract_url": "https://www.ai.vixra.org/abs/2607.0031",
    "first_submitted_at": "2026-07-12T22:58:40+00:00",
    "latest_declared_version": "v1",
    "latest_submitted_at": "2026-07-12T22:58:40+00:00",
    "mirrored_version": "v1",
    "mirror_pdf_url": "https://github.com/arr-research/arr-research.github.io/releases/download/AIVIXRA-LATEST-2026-08-30/ai-vixra-2607.0031-v1.pdf",
    "mirror_release_url": "https://github.com/arr-research/arr-research.github.io/releases/tag/AIVIXRA-LATEST-2026-08-30",
    "versions": [
      {
        "version": "v1",
        "submitted_at": "2026-07-12T22:58:40+00:00",
        "pdf_url": "https://www.ai.vixra.org/pdf/2607.0031v1.pdf"
      }
    ]
  },
  "licenses": {
    "manuscript": "LicenseRef-Author-Retained",
    "metadata": "CC0-1.0",
    "code": [],
    "data": []
  },
  "source_of_truth": "external_pdf",
  "keywords": [
    "Quantum Physics"
  ],
  "subjects": [
    "Quantum Physics"
  ],
  "deposit": {
    "depositor_name": "Lluis Eriksson",
    "relationship": "author",
    "deposit_authorized": true,
    "third_party_material_disclosed": false,
    "terms_version": "ARR-HISTORICAL-IMPORT-1.0"
  },
  "integrity": {
    "algorithm": "sha256",
    "manifest": "MANIFEST.sha256",
    "canonical_sha256": "a3eb2f8fcea49b5c6de4312aead239ccb60bba17e93ec314a44658fb77a456aa",
    "canonical_bytes": 228675
  },
  "ai_assistance": {
    "used": true,
    "statement": "Historical import from ai.vixra, an AI-assisted e-print archive. ARR has not normalized or independently verified the original manuscript's model-use disclosure; the author remains responsible for its contents."
  },
  "screening": {
    "protocol": "ARR-SCREEN-1.0",
    "status": "not_assessed",
    "critical_objections_unresolved": 0,
    "human_signoff": true,
    "evaluators": []
  },
  "verification": {
    "protocol": "ARR-HISTORICAL-IMPORT-1.0",
    "bibliography": "not_assessed",
    "source_integrity": "pass",
    "reproducibility": "not_assessed",
    "lean4": "not_assessed",
    "report": "VERIFICATION.md"
  },
  "editorial": {
    "decision": "historical_import",
    "signed_by": "Lluis Eriksson",
    "conflicts": [
      "author_is_founder_editor"
    ],
    "statement": "Author-authorized historical import. ARR verified file retrieval and integrity only; it did not perform the current hostile frontier-model admission audit, peer review, novelty review, or correctness certification."
  }
}
