{
  "schema_version": "1.4",
  "record_id": "arr:record:eeb507b1-b6c7-4996-bc62-a4e7c416be00",
  "version_id": "arr:version:7cf50607-2703-4920-bf35-ea247b4dc9da",
  "id": "ARR-2026-7EPM3V3DP796BBRR",
  "version": "v3",
  "record_type": "research_paper",
  "title": "Coarse information and finite rank obstructions for flat lattice Hodge forms",
  "abstract": "On a finite periodic lattice with unit spacing, a flat Hodge form cannot have a positive coercivity constant uniform under refinement when supplemented only by linear observations in a fixed finite-dimensional real space and linear fine-space repairs of uniformly bounded rank. We construct a real physical Fourier band, prove the necessary dimension budget and a bounded-rank linear-sector obstruction, and explain the fixed-map cross-coupling limitation through a classical singular-Schur criterion. We construct componentwise derivative repairs and prove a differentiable-observation tangent obstruction. An analytic implicit-function argument extends the obstruction to exact nonlinear regular sectors; counterexamples delimit its regularity and quadratic-energy hypotheses. The operator and full-space tangent results have separately pinned Lean evidence; the exact regular-sector extension remains analytic. These are finite flat statements, with no interacting or continuum mass-gap claim.",
  "authors": [
    {
      "name": "Lluis Eriksson",
      "affiliation": "Independent researcher"
    }
  ],
  "date": "2026-10-31",
  "status": "working_paper",
  "licenses": {
    "manuscript": "CC-BY-4.0",
    "metadata": "CC0-1.0",
    "code": [],
    "data": []
  },
  "source_of_truth": "paper.pdf",
  "keywords": [
    "Mathematical Physics"
  ],
  "subjects": [
    "Mathematical Physics"
  ],
  "deposit": {
    "depositor_name": "Lluis Eriksson",
    "relationship": "author",
    "deposit_authorized": true,
    "third_party_material_disclosed": false,
    "terms_version": "ARR-DEPOSIT-2.0"
  },
  "integrity": {
    "algorithm": "sha256",
    "manifest": "MANIFEST.sha256",
    "canonical_sha256": "c9de923a66038ed66c3f68ecf8256b3f738a3ccf27e41f77e470bf7dc3efb5b9",
    "canonical_bytes": 362292
  },
  "ai_assistance": {
    "used": true,
    "statement": "Prepared by Codex in the continuing programme chat, with preparing-agent source and exact-PDF visual audit. Actual served backend identity and reasoning setting are not exposed. No new external model assessed this exact candidate; prior v2 reports do not assess these bytes. No numerical rating, independence, human peer review or editorial acceptance claimed. Formal source anchors and analytic arguments are separated in the manuscript."
  },
  "screening": {
    "critical_objections_unresolved": 0,
    "protocol": "ARR-SCREEN-1.0",
    "human_signoff": false,
    "evaluators": [],
    "status": "not_assessed"
  },
  "verification": {
    "source_integrity": "pass",
    "report": "VERIFICATION.md",
    "reproducibility": "not_assessed",
    "lean4": "not_assessed",
    "protocol": "ERIKSSON-EXACT-ARTIFACT-20261031",
    "bibliography": "not_assessed"
  },
  "editorial": {
    "decision": "working_deposit",
    "conflicts": [
      "author_is_founder_editor"
    ],
    "statement": "Exact-v3 author-authorized Working paper, not admitted to the AIRR accepted collection. Preparing-agent source and visual audit only. No external model assessment of these bytes, numerical score, independent peer review, human editorial admission or acceptance is asserted.",
    "signed_by": "Lluis Eriksson"
  },
  "supersedes_version_id": "arr:version:1047e4db-2050-4f7f-9f41-9c526bdbe570",
  "revision": {
    "summary": "Consolidates actual global componentwise gradient/Hodge identity, constructed weighted derivative repairs and differentiable-observation tangent obstruction, plus analytic exact regular nonlinear-sector extension and explicit regularity/energy counterexamples. Finite flat unit-spacing scope. Regular-sector extension is analytic in this frozen PDF. No later coexact-band results or inherited v2 model assessments.",
    "change_size": "major"
  },
  "release_url": "https://github.com/arr-research/arr-research.github.io/releases/tag/ARR-2026-7EPM3V3DP796BBRR-v3"
}
