{
  "schema_version": "1.3",
  "record_id": "arr:record:cdb232dc-7cc7-4452-af26-e5f962b97bfe",
  "version_id": "arr:version:9dc7d047-f3d5-4784-ba5d-9f3b58137267",
  "id": "ARR-2026-6DP8SDRZ678H9AY9",
  "version": "v1",
  "record_type": "research_paper",
  "title": "One Amos Bound, Three Consumer Sites: Machine-Checked Bessel-Ratio Calculus for Lattice Gauge Expansions",
  "abstract": "The Amos-type upper bound on the modified-Bessel ratio, I{nu+1}(x)/I_nu(x) < x/(nu + 1/2 + sqrt((nu+1/2)^2 + x^2)), has a distinguished algebraic property: its right-hand side U satisfies the exact calibration identity 1/U - U = (2nu+1)/x. From that identity alone — by ordered-field algebra, with no further analytic input — follow a unit-step inequality rho_nu - rho{nu+1} < 1/x for consecutive ratios, the strict increase of the log-derivative (log I_nu)' = rho_nu + nu/x across orders, and the strict monotonicity of a phi-sequence arising in a two-dimensional lattice-gauge surface expansion. We formalize this calculus in Lean 4: a single module defines the bound once (AmosBound) and proves the calibration engine and four consequence theorems through that one definition, together with two rational satisfiability witnesses whose Amos hypothesis holds by exact Pythagorean arithmetic; all eighteen Lean statements of the development pass the axiom oracle with exactly [propext, Classical.choice, Quot.sound] against a pinned Mathlib. A certified companion (256-bit interval arithmetic, self-contained series-plus-tail enclosures, committed transcript) certifies the bound provably strictly at all 1206 points of a pre-registered grid covering the arguments the applications consume. A Bessel interface completes the closure: integer-order I_n is defined by its power series in the same pinned development, with positivity, the three-term recurrence, the termwise-differentiated derivative identity I_n' = I_{n+1} + (n/x) I_n, and the logarithmic-derivative identity (log I_n)' = rho_n + n/x all proved as theorems, so the consequence theorems — including the unit step read as strict log-derivative monotonicity, in deriv form — hold for genuine Bessel ratios with the Amos bound as the single remaining hypothesis. The scope is stated exactly: the Amos bound itself remains a classical cited theorem taken as hypothesis — this paper unifies its three previously scattered uses in our formal development into one named proposition with one oracle and one certified numerical witness, and no downstream result changes its verification class.",
  "authors": [
    {
      "name": "Lluis Eriksson",
      "affiliation": "Independent researcher"
    }
  ],
  "date": "2026-07-12",
  "status": "archived",
  "archival_source": {
    "archive": "ai.vixra",
    "identifier": "2607.0033",
    "abstract_url": "https://www.ai.vixra.org/abs/2607.0033",
    "first_submitted_at": "2026-07-12T13:19:13+00:00",
    "latest_declared_version": "v1",
    "latest_submitted_at": "2026-07-12T13:19:13+00:00",
    "mirrored_version": "v1",
    "mirror_pdf_url": "https://github.com/arr-research/arr-research.github.io/releases/download/AIVIXRA-LATEST-2026-08-30/ai-vixra-2607.0033-v1.pdf",
    "mirror_release_url": "https://github.com/arr-research/arr-research.github.io/releases/tag/AIVIXRA-LATEST-2026-08-30",
    "versions": [
      {
        "version": "v1",
        "submitted_at": "2026-07-12T13:19:13+00:00",
        "pdf_url": "https://www.ai.vixra.org/pdf/2607.0033v1.pdf"
      }
    ]
  },
  "licenses": {
    "manuscript": "LicenseRef-Author-Retained",
    "metadata": "CC0-1.0",
    "code": [],
    "data": []
  },
  "source_of_truth": "external_pdf",
  "keywords": [
    "Mathematical Physics"
  ],
  "subjects": [
    "Mathematical Physics"
  ],
  "deposit": {
    "depositor_name": "Lluis Eriksson",
    "relationship": "author",
    "deposit_authorized": true,
    "third_party_material_disclosed": false,
    "terms_version": "ARR-HISTORICAL-IMPORT-1.0"
  },
  "integrity": {
    "algorithm": "sha256",
    "manifest": "MANIFEST.sha256",
    "canonical_sha256": "d13ccb296b9d4f9fc9fca1624487328eab40d5d32bdb213a220eb0cfc2adc972",
    "canonical_bytes": 138893
  },
  "ai_assistance": {
    "used": true,
    "statement": "Historical import from ai.vixra, an AI-assisted e-print archive. ARR has not normalized or independently verified the original manuscript's model-use disclosure; the author remains responsible for its contents."
  },
  "screening": {
    "protocol": "ARR-SCREEN-1.0",
    "status": "not_assessed",
    "critical_objections_unresolved": 0,
    "human_signoff": true,
    "evaluators": []
  },
  "verification": {
    "protocol": "ARR-HISTORICAL-IMPORT-1.0",
    "bibliography": "not_assessed",
    "source_integrity": "pass",
    "reproducibility": "not_assessed",
    "lean4": "not_assessed",
    "report": "VERIFICATION.md"
  },
  "editorial": {
    "decision": "historical_import",
    "signed_by": "Lluis Eriksson",
    "conflicts": [
      "author_is_founder_editor"
    ],
    "statement": "Author-authorized historical import. ARR verified file retrieval and integrity only; it did not perform the current hostile frontier-model admission audit, peer review, novelty review, or correctness certification."
  }
}
