{
  "schema_version": "1.3",
  "record_id": "arr:record:635b8d31-c787-43c9-a3bf-d969731ac2c6",
  "version_id": "arr:version:884b39ba-aeb5-4f4c-868f-2b266a688c28",
  "id": "ARR-2026-33BE6K3HW78F4T7F",
  "version": "v1",
  "record_type": "research_paper",
  "title": "Exact Memory of Direct-Sum Spectral Fan-Out: Generic Maximality, Colliding Targets, and the Three-Line Phase Diagram",
  "abstract": "At L boundary frequencies, a passive lossless network must route one fixed k-dimensional input channel to prescribed output k-planes. For targets with joint span dimension r, every square finite rational-inner interpolant satisfies the sharp universal sandwich r-k <= d_min <= k(L-1). Direct-sum targets therefore have exact minimum McMillan degree k(L-1); when N >= Lk this maximal-memory locus is open and dense. The paper gives an explicit positive Pick completion, a realization- and inertia-based lower bound, a family of targets that collide while retaining maximal exact degree for every nonzero opening, an exact quadratic certification margin, and a fail-closed noisy projector test. For three scalar target lines it also proves the complete phase diagram: degree zero for one common line, degree one exactly for three distinct coplanar lines, and degree two otherwise. Deterministic certificates and an independent implementation accompany the proofs.",
  "authors": [
    {
      "name": "Lluis Eriksson",
      "affiliation": "Independent researcher"
    }
  ],
  "date": "2026-08-11",
  "status": "archived",
  "archival_source": {
    "archive": "ai.vixra",
    "identifier": "2608.0045",
    "abstract_url": "https://www.ai.vixra.org/abs/2608.0045",
    "first_submitted_at": "2026-08-11T15:57:16+00:00",
    "latest_declared_version": "v1",
    "latest_submitted_at": "2026-08-11T15:57:16+00:00",
    "mirrored_version": "v1",
    "mirror_pdf_url": "https://github.com/arr-research/arr-research.github.io/releases/download/AIVIXRA-LATEST-2026-08-30/ai-vixra-2608.0045-v1.pdf",
    "mirror_release_url": "https://github.com/arr-research/arr-research.github.io/releases/tag/AIVIXRA-LATEST-2026-08-30",
    "versions": [
      {
        "version": "v1",
        "submitted_at": "2026-08-11T15:57:16+00:00",
        "pdf_url": "https://www.ai.vixra.org/pdf/2608.0045v1.pdf"
      }
    ]
  },
  "licenses": {
    "manuscript": "LicenseRef-Author-Retained",
    "metadata": "CC0-1.0",
    "code": [],
    "data": []
  },
  "source_of_truth": "external_pdf",
  "keywords": [
    "Mathematical Physics"
  ],
  "subjects": [
    "Mathematical Physics"
  ],
  "deposit": {
    "depositor_name": "Lluis Eriksson",
    "relationship": "author",
    "deposit_authorized": true,
    "third_party_material_disclosed": false,
    "terms_version": "ARR-HISTORICAL-IMPORT-1.0"
  },
  "integrity": {
    "algorithm": "sha256",
    "manifest": "MANIFEST.sha256",
    "canonical_sha256": "7366328bce0f2de84667acc5e2363baa29a266dd29e859fbec87237a10cd15e1",
    "canonical_bytes": 356986
  },
  "ai_assistance": {
    "used": true,
    "statement": "Historical import from ai.vixra, an AI-assisted e-print archive. ARR has not normalized or independently verified the original manuscript's model-use disclosure; the author remains responsible for its contents."
  },
  "screening": {
    "protocol": "ARR-SCREEN-1.0",
    "status": "not_assessed",
    "critical_objections_unresolved": 0,
    "human_signoff": true,
    "evaluators": []
  },
  "verification": {
    "protocol": "ARR-HISTORICAL-IMPORT-1.0",
    "bibliography": "not_assessed",
    "source_integrity": "pass",
    "reproducibility": "not_assessed",
    "lean4": "not_assessed",
    "report": "VERIFICATION.md"
  },
  "editorial": {
    "decision": "historical_import",
    "signed_by": "Lluis Eriksson",
    "conflicts": [
      "author_is_founder_editor"
    ],
    "statement": "Author-authorized historical import. ARR verified file retrieval and integrity only; it did not perform the current hostile frontier-model admission audit, peer review, novelty review, or correctness certification."
  }
}
