{
  "schema_version": "1.1",
  "record_id": "arr:record:22e20904-af6c-42ee-a75f-73786281243d",
  "version_id": "arr:version:6ec382e4-810c-4e27-b826-2072d9a14d64",
  "id": "ARR-2026-12W84G9BVC8BQAEQ",
  "version": "v1",
  "record_type": "research_paper",
  "title": "Exact Rank Transitions through p=32 and a Half-Integral Optimum at p=53",
  "abstract": "For F_(p,q)=diag(q repeated p times, -p repeated q times), this paper studies the least rank among factors minimizing one half of the squared Hilbert--Schmidt norm subject to CC^*-C^*C=2F. On q=2p+1, exact rational hive primal-dual certificates determine the complete finite cost-and-rank frontier for 4<=p<=32: the rank excess above q is 0 on p=4..7, 1 on p=8..14, 2 on p=15..26, 3 at p=27, and 4 on p=28..32. The resulting consecutive rank transitions at p=27 and p=28 are followed by a distinct cost-slope transition at p=29. Separately, exact certificates prove kappa(F_(53,107))=8847 with minimum attaining rank 115; its optimum is half-integral, while an earlier integer candidate of trace 8843 is refuted by an integral Farkas certificate. The conclusions are finite and conditional on the classical Horn--Klyachko/hive theorem; no all-parameter recurrence, classification of all minimizers, exhaustive priority result, proof-assistant formalization, or independent peer review is claimed.",
  "authors": [
    {
      "name": "Lluis Eriksson",
      "affiliation": "Independent researcher"
    }
  ],
  "date": "2026-09-02",
  "status": "accepted",
  "licenses": {
    "manuscript": "CC-BY-4.0",
    "metadata": "CC0-1.0",
    "code": [
      {"path": "src/**/*.py", "spdx": "AGPL-3.0-only"}
    ],
    "data": [
      {"path": "src/repro/**/*.json", "spdx": "CC0-1.0"}
    ]
  },
  "source_of_truth": "paper.pdf",
  "keywords": [
    "inverse self-commutator",
    "Hilbert--Schmidt norm",
    "minimum rank",
    "Horn inequalities",
    "hive polytope",
    "rank transition",
    "Farkas certificate",
    "half-integral optimum"
  ],
  "subjects": [
    "Matrix analysis",
    "Operator theory",
    "Algebraic combinatorics",
    "Exact computational mathematics"
  ],
  "related_records": [
    {
      "id": "ARR-2026-5QQF95VHTC9GABH8",
      "relationship": "extends",
      "note": "The related record supplies the earlier exact low-dimensional and amplification results. This paper extends the finite two-ray frontier through p=32 and adds the independent p=53 theorem and exact refutation."
    }
  ],
  "deposit": {
    "depositor_name": "Lluis Eriksson",
    "relationship": "author",
    "deposit_authorized": true,
    "third_party_material_disclosed": true,
    "terms_version": "ARR-DEPOSIT-0.1"
  },
  "integrity": {
    "algorithm": "sha256",
    "manifest": "MANIFEST.sha256",
    "canonical_sha256": "3fe985b56fb83278d16fbbf55975a77d4964b87311ef4490c74fea8766b7fe1a",
    "canonical_bytes": 21272
  },
  "ai_assistance": {
    "used": true,
    "statement": "OpenAI Codex assisted with corpus triage, mathematical exploration, exact certificate reconstruction, adversarial verification, manuscript revision, typesetting, visual QA, reproducibility hardening, and ARR record preparation. The author selected the claims, authorized publication, and remains responsible for the work.",
    "systems": [
      "OpenAI Codex"
    ]
  },
  "screening": {
    "protocol": "ARR-SCREEN-1.0",
    "status": "not_assessed",
    "critical_objections_unresolved": 0,
    "human_signoff": true,
    "evaluators": []
  },
  "verification": {
    "protocol": "ARR-VERIFY-1.0",
    "source_integrity": "pass",
    "reproducibility": "partial",
    "lean4": "not_applicable",
    "bibliography": "partial",
    "report": "VERIFICATION.md"
  },
  "editorial": {
    "decision": "founder_pilot",
    "signed_by": "Lluis Eriksson",
    "conflicts": [
      "author_is_founder_editor"
    ],
    "statement": "Founder-owned pilot record: the author and editorial signer are the same person; no independent editorial review is claimed."
  }
}
