{
  "schema_version": "1.1",
  "record_id": "arr:record:7107e7c9-5221-4522-97f5-328da7018f43",
  "version_id": "arr:version:efdbfb10-5c8b-4e0f-a04f-709d6bb6dabf",
  "id": "ARR-2026-3H0ZKWJMH18MH9FX",
  "version": "v1",
  "record_type": "research_paper",
  "title": "Strictly Scalable Exterior Decoders for Quantum Lists: Exact Full-Spark Widths and Fixed-Probe Weyl Bayes Curves",
  "abstract": "A quantum list measurement succeeds when its output contains the prepared label. Building on the known equivalence between learning width and Gram-matrix factor width, this paper closes an exact realization-sensitive branch. Every full-spark ensemble of N pure-state rays spanning C^r that admits strictly positive tight representatives has minimum zero-error list size N-r+1. Weighted Hodge duals of all (r-1)-fold frame wedges give an explicit attaining POVM, and a physical-space annihilator-cone formulation gives constructive compression to at most r^2 outcomes. A smallest-eigenvalue functional supplies a positive and perturbatively stable Bayes-error floor below threshold. For a flat consecutive-support Schmidt-rank-r probe of the complete d-dimensional Weyl-channel ensemble, the fixed-probe threshold is d-r+1. When r divides d, an arithmetic-support construction and dimension converse close the optimization over all pure Schmidt-rank-r probes at d/r. For the consecutive rank-two probe, the complete one-shot Bayes list curve is determined exactly. The nondivisible probe optimum, adaptive or multiuse testers, asymptotic capacity, arbitrary mixed states, and non-scalable full-spark ensembles remain outside scope.",
  "authors": [
    {
      "name": "Lluis Eriksson",
      "affiliation": "Independent researcher"
    }
  ],
  "date": "2026-08-24",
  "status": "accepted",
  "licenses": {
    "manuscript": "CC-BY-4.0",
    "metadata": "CC0-1.0",
    "code": [
      {"path": "src/replay/*.py", "spdx": "Apache-2.0"}
    ],
    "data": [
      {"path": "src/replay/results/*.json", "spdx": "CC0-1.0"}
    ]
  },
  "source_of_truth": "paper.pdf",
  "keywords": [
    "quantum list discrimination",
    "learning width",
    "factor width",
    "full-spark frames",
    "scalable frames",
    "exterior algebra",
    "Weyl channels"
  ],
  "subjects": [
    "Quantum information",
    "Mathematical physics",
    "Frame theory"
  ],
  "related_records": [
    {
      "id": "ARR-2026-15SJ1ANHDN8D88Z1",
      "relationship": "extends",
      "note": "The related record develops support-matroid bounds for quantum list discrimination and contains the earlier (4,2,2) subthreshold fixture. This independent paper gives realization-sensitive full-spark/scalability thresholds, exact Weyl probe frontiers, and the full consecutive rank-two Bayes curve."
    }
  ],
  "deposit": {
    "depositor_name": "Lluis Eriksson",
    "relationship": "author",
    "deposit_authorized": true,
    "third_party_material_disclosed": true,
    "terms_version": "ARR-DEPOSIT-0.1"
  },
  "integrity": {
    "algorithm": "sha256",
    "manifest": "MANIFEST.sha256",
    "canonical_sha256": "bf67bc3c4ae3f0b191c375691c375b93f9fdb3b70ce7f16f031bcb905324e16f",
    "canonical_bytes": 447420
  },
  "ai_assistance": {
    "used": true,
    "statement": "OpenAI Codex assisted with theorem exploration, literature triage, proof stress testing, exact verifier development, manuscript editing, reproducibility checks, visual PDF inspection, machine-readable extraction, and ARR deposit preparation. A separate Codex task supplied critical model feedback recorded as an informal audit, not as peer review or scientific validation. The author selected and reviewed the claims, assumptions, proofs, citations, and executable evidence and remains responsible for the work.",
    "systems": ["OpenAI Codex"]
  },
  "screening": {
    "protocol": "ARR-SCREEN-1.0",
    "status": "not_assessed",
    "critical_objections_unresolved": 0,
    "human_signoff": true,
    "evaluators": []
  },
  "verification": {
    "protocol": "ARR-VERIFY-1.0",
    "bibliography": "partial",
    "source_integrity": "pass",
    "reproducibility": "partial",
    "lean4": "not_applicable",
    "report": "VERIFICATION.md"
  },
  "editorial": {
    "decision": "founder_pilot",
    "signed_by": "Lluis Eriksson",
    "conflicts": ["author_is_founder_editor"],
    "statement": "Founder-owned record: Lluis Eriksson is both the author and ARR's current founder-editor. No independent editorial review, peer review, frontier-model screening, novelty certification, or scientific certification is claimed. Acceptance records a technically valid deposit, not a finding that the paper is correct."
  }
}
