{
  "schema_version": "1.3",
  "record_id": "arr:record:ab937c6b-cf31-4dd7-abe7-67e2628fcf8c",
  "version_id": "arr:version:4b86b734-21c9-4ca6-be20-4673bae71d87",
  "id": "ARR-2026-5BJDY6QKSH9QBTQS",
  "version": "v1",
  "record_type": "research_paper",
  "title": "Modular Recovery from Split Inclusions: A B-minimal Bridge from QFT Collar Geometry to Approximate State Reconstruction",
  "abstract": "In algebraic quantum field theory (AQFT), local algebras are typically Type III factors, so density matrices and von Neumann entropies are unavailable for bounded regions. We formulate a B-minimal continuum analog of the lattice \"collar => Markovness => recovery\" mechanism by combining: (i) the split property as the mathematical replacement of a buffer (collar), (ii) Araki relative entropy to define a split-regularized conditional mutual information I^N(A:C|B) relative to fixed Type I interpolating data N, and (iii) modular/twirled Petz recovery as an explicit candidate recovery channel. Assuming an FR-type recoverability inequality in the fixed-split setting, we obtain quantitative recovery bounds in a fidelity-based error metric (purified distance). We conclude with a conditional holographic remark. v2 corrects the fidelity-convention factor in the assumed FR-type inequality: with the squared (Bures/Uhlmann-squared) convention used throughout, the importable finite-dimensional motivation gives -log F <= I, not -log F <= I/2; v1's half-form is strictly stronger than its motivation and is refuted as a finite-dimensional anchor on 40/40 random tripartite states (the corrected form holds on 40/40) -- the same factor-2 correction applied in 2512.0101 v2 and 2601.0020 v2. The recovery theorem's constant changes by sqrt(2); the exponent is unaffected. v2 further adds series positioning, a compatibility remark with the split-regularized CMI of 2601.0020, a concrete demonstration that I^N can be negative for unfavorable split data -- nonnegativity of I^N is part of the good-split-data regime, not automatic -- and a finite-dimensional verification suite for every checkable ingredient of the dictionary.",
  "authors": [
    {
      "name": "Lluis Eriksson",
      "affiliation": "Independent researcher"
    }
  ],
  "date": "2026-01-11",
  "status": "archived",
  "archival_source": {
    "archive": "ai.vixra",
    "identifier": "2601.0034",
    "abstract_url": "https://www.ai.vixra.org/abs/2601.0034",
    "first_submitted_at": "2026-01-11T09:52:52+00:00",
    "latest_declared_version": "v2",
    "latest_submitted_at": "2026-07-05T13:15:01+00:00",
    "mirrored_version": "v2",
    "mirror_pdf_url": "https://github.com/arr-research/arr-research.github.io/releases/download/AIVIXRA-LATEST-2026-08-30/ai-vixra-2601.0034-v2.pdf",
    "mirror_release_url": "https://github.com/arr-research/arr-research.github.io/releases/tag/AIVIXRA-LATEST-2026-08-30",
    "versions": [
      {
        "version": "v1",
        "submitted_at": "2026-01-11T09:52:52+00:00",
        "pdf_url": "https://www.ai.vixra.org/pdf/2601.0034v1.pdf"
      },
      {
        "version": "v2",
        "submitted_at": "2026-07-05T13:15:01+00:00",
        "pdf_url": "https://www.ai.vixra.org/pdf/2601.0034v2.pdf"
      }
    ]
  },
  "licenses": {
    "manuscript": "LicenseRef-Author-Retained",
    "metadata": "CC0-1.0",
    "code": [],
    "data": []
  },
  "source_of_truth": "external_pdf",
  "keywords": [
    "Quantum Physics"
  ],
  "subjects": [
    "Quantum Physics"
  ],
  "deposit": {
    "depositor_name": "Lluis Eriksson",
    "relationship": "author",
    "deposit_authorized": true,
    "third_party_material_disclosed": false,
    "terms_version": "ARR-HISTORICAL-IMPORT-1.0"
  },
  "integrity": {
    "algorithm": "sha256",
    "manifest": "MANIFEST.sha256",
    "canonical_sha256": "4abff7f5961f8b5fab943467c9e8a96232efeadd36f8641e60e834464f5527b3",
    "canonical_bytes": 246842
  },
  "ai_assistance": {
    "used": true,
    "statement": "Historical import from ai.vixra, an AI-assisted e-print archive. ARR has not normalized or independently verified the original manuscript's model-use disclosure; the author remains responsible for its contents."
  },
  "screening": {
    "protocol": "ARR-SCREEN-1.0",
    "status": "not_assessed",
    "critical_objections_unresolved": 0,
    "human_signoff": true,
    "evaluators": []
  },
  "verification": {
    "protocol": "ARR-HISTORICAL-IMPORT-1.0",
    "bibliography": "not_assessed",
    "source_integrity": "pass",
    "reproducibility": "not_assessed",
    "lean4": "not_assessed",
    "report": "VERIFICATION.md"
  },
  "editorial": {
    "decision": "historical_import",
    "signed_by": "Lluis Eriksson",
    "conflicts": [
      "author_is_founder_editor"
    ],
    "statement": "Author-authorized historical import. ARR verified file retrieval and integrity only; it did not perform the current hostile frontier-model admission audit, peer review, novelty review, or correctness certification."
  }
}
